{
  "generated_at": "2026-05-15T15:30:01.254232+00:00",
  "tool_version": "0.1.0",
  "summary": {
    "total_documents": 746,
    "total_unique_fiches": 217,
    "processed_unique_fiches": 217,
    "total_pdf": 737,
    "total_office": 7,
    "total_html": 15,
    "fiches_with_json": 217,
    "fiches_with_markdown": 217,
    "fiches_with_empty_text": 0,
    "fiches_needing_review": 1,
    "fiches_missing_required_documents": 0,
    "fiches_missing_calculation": 1,
    "extracted": 217,
    "failed": 0,
    "needs_review": 1
  },
  "priority_failures": [],
  "items": [
    {
      "source_file": "Agriculture_AGRI/AGRI-EQ-101 vA14-1.pdf",
      "output_files": [
        "data/text/AGRI-EQ-101.txt",
        "data/markdown/AGRI-EQ-101.md",
        "data/json/AGRI-EQ-101.json"
      ],
      "status": "extracted",
      "text_length": 1201,
      "warnings": [],
      "error": null
    },
    {
      "source_file": "Agriculture_AGRI/AGRI-EQ-102 vA65-2 à compter du 01-04-2025_0.pdf",
      "output_files": [
        "data/text/AGRI-EQ-102.txt",
        "data/markdown/AGRI-EQ-102.md",
        "data/json/AGRI-EQ-102.json"
      ],
      "status": "extracted",
      "text_length": 1266,
      "warnings": [],
      "error": null
    },
    {
      "source_file": "Agriculture_AGRI/AGRI-EQ-104 vA62-2 à compter du 01-01-2025_0.pdf",
      "output_files": [
        "data/text/AGRI-EQ-104.txt",
        "data/markdown/AGRI-EQ-104.md",
        "data/json/AGRI-EQ-104.json"
      ],
      "status": "extracted",
      "text_length": 1095,
      "warnings": [],
      "error": null
    },
    {
      "source_file": "Agriculture_AGRI/AGRI-EQ-105 vA28-1 à compter du 19-12-2018.pdf",
      "output_files": [
        "data/text/AGRI-EQ-105.txt",
        "data/markdown/AGRI-EQ-105.md",
        "data/json/AGRI-EQ-105.json"
      ],
      "status": "extracted",
      "text_length": 1635,
      "warnings": [],
      "error": null
    },
    {
      "source_file": "Agriculture_AGRI/AGRI-EQ-106 vA32-1.pdf",
      "output_files": [
        "data/text/AGRI-EQ-106.txt",
        "data/markdown/AGRI-EQ-106.md",
        "data/json/AGRI-EQ-106.json"
      ],
      "status": "extracted",
      "text_length": 5692,
      "warnings": [],
      "error": null
    },
    {
      "source_file": "Agriculture_AGRI/AGRI-EQ-107 vA38-1 à compter du 31-07-2021.pdf",
      "output_files": [
        "data/text/AGRI-EQ-107.txt",
        "data/markdown/AGRI-EQ-107.md",
        "data/json/AGRI-EQ-107.json"
      ],
      "status": "extracted",
      "text_length": 2492,
      "warnings": [],
      "error": null
    },
    {
      "source_file": "Agriculture_AGRI/AGRI-EQ-108 vA58-2 à compter du 01-02-2024_0.pdf",
      "output_files": [
        "data/text/AGRI-EQ-108.txt",
        "data/markdown/AGRI-EQ-108.md",
        "data/json/AGRI-EQ-108.json"
      ],
      "status": "extracted",
      "text_length": 2936,
      "warnings": [],
      "error": null
    },
    {
      "source_file": "Agriculture_AGRI/AGRI-EQ-109 vA58-2 à compter du 01-02-2024_0.pdf",
      "output_files": [
        "data/text/AGRI-EQ-109.txt",
        "data/markdown/AGRI-EQ-109.md",
        "data/json/AGRI-EQ-109.json"
      ],
      "status": "extracted",
      "text_length": 3088,
      "warnings": [],
      "error": null
    },
    {
      "source_file": "Agriculture_AGRI/AGRI-EQ-110 vA38-1 à compter du 31-07-2021.pdf",
      "output_files": [
        "data/text/AGRI-EQ-110.txt",
        "data/markdown/AGRI-EQ-110.md",
        "data/json/AGRI-EQ-110.json"
      ],
      "status": "extracted",
      "text_length": 3385,
      "warnings": [],
      "error": null
    },
    {
      "source_file": "Agriculture_AGRI/AGRI-EQ-111 vA62-1 à compter du 31-08-2024_0.pdf",
      "output_files": [
        "data/text/AGRI-EQ-111.txt",
        "data/markdown/AGRI-EQ-111.md",
        "data/json/AGRI-EQ-111.json"
      ],
      "status": "extracted",
      "text_length": 1299,
      "warnings": [],
      "error": null
    },
    {
      "source_file": "Agriculture_AGRI/AGRI-EQ-112 vA73-3 à compter du 01-09-2025_0.pdf",
      "output_files": [
        "data/text/AGRI-EQ-112.txt",
        "data/markdown/AGRI-EQ-112.md",
        "data/json/AGRI-EQ-112.json"
      ],
      "status": "extracted",
      "text_length": 1771,
      "warnings": [],
      "error": null
    },
    {
      "source_file": "Agriculture_AGRI/AGRI-SE-101 vA40-2 à compter du 01-04-2022_0.pdf",
      "output_files": [
        "data/text/AGRI-SE-101.txt",
        "data/markdown/AGRI-SE-101.md",
        "data/json/AGRI-SE-101.json"
      ],
      "status": "extracted",
      "text_length": 1650,
      "warnings": [],
      "error": null
    },
    {
      "source_file": "Agriculture_AGRI/AGRI-TH-101 vA62-2 à compter du 01-01-2025.pdf",
      "output_files": [
        "data/text/AGRI-TH-101.txt",
        "data/markdown/AGRI-TH-101.md",
        "data/json/AGRI-TH-101.json"
      ],
      "status": "extracted",
      "text_length": 1075,
      "warnings": [],
      "error": null
    },
    {
      "source_file": "Agriculture_AGRI/AGRI-TH-102 vA14-1.pdf",
      "output_files": [
        "data/text/AGRI-TH-102.txt",
        "data/markdown/AGRI-TH-102.md",
        "data/json/AGRI-TH-102.json"
      ],
      "status": "extracted",
      "text_length": 963,
      "warnings": [],
      "error": null
    },
    {
      "source_file": "Agriculture_AGRI/AGRI-TH-103 vA15-1.pdf",
      "output_files": [
        "data/text/AGRI-TH-103.txt",
        "data/markdown/AGRI-TH-103.md",
        "data/json/AGRI-TH-103.json"
      ],
      "status": "extracted",
      "text_length": 1568,
      "warnings": [],
      "error": null
    },
    {
      "source_file": "Agriculture_AGRI/AGRI-TH-104 vA35-3 à compter du 01-10-2020.pdf",
      "output_files": [
        "data/text/AGRI-TH-104.txt",
        "data/markdown/AGRI-TH-104.md",
        "data/json/AGRI-TH-104.json"
      ],
      "status": "extracted",
      "text_length": 8918,
      "warnings": [],
      "error": null
    },
    {
      "source_file": "Agriculture_AGRI/AGRI-TH-105 vA16-1.pdf",
      "output_files": [
        "data/text/AGRI-TH-105.txt",
        "data/markdown/AGRI-TH-105.md",
        "data/json/AGRI-TH-105.json"
      ],
      "status": "extracted",
      "text_length": 1565,
      "warnings": [],
      "error": null
    },
    {
      "source_file": "Agriculture_AGRI/AGRI-TH-108 vA35-2 à compter du 01-10-2020.pdf",
      "output_files": [
        "data/text/AGRI-TH-108.txt",
        "data/markdown/AGRI-TH-108.md",
        "data/json/AGRI-TH-108.json"
      ],
      "status": "extracted",
      "text_length": 4341,
      "warnings": [],
      "error": null
    },
    {
      "source_file": "Agriculture_AGRI/AGRI-TH-109 vA54-2 à compter du 01-01-2024_0.pdf",
      "output_files": [
        "data/text/AGRI-TH-109.txt",
        "data/markdown/AGRI-TH-109.md",
        "data/json/AGRI-TH-109.json"
      ],
      "status": "extracted",
      "text_length": 1556,
      "warnings": [],
      "error": null
    },
    {
      "source_file": "Agriculture_AGRI/AGRI-TH-110 vA54-3 à compter du 01-01-2024_0.pdf",
      "output_files": [
        "data/text/AGRI-TH-110.txt",
        "data/markdown/AGRI-TH-110.md",
        "data/json/AGRI-TH-110.json"
      ],
      "status": "extracted",
      "text_length": 2228,
      "warnings": [],
      "error": null
    },
    {
      "source_file": "Agriculture_AGRI/AGRI-TH-113 vA14-1.pdf",
      "output_files": [
        "data/text/AGRI-TH-113.txt",
        "data/markdown/AGRI-TH-113.md",
        "data/json/AGRI-TH-113.json"
      ],
      "status": "extracted",
      "text_length": 1869,
      "warnings": [],
      "error": null
    },
    {
      "source_file": "Agriculture_AGRI/AGRI-TH-117 vA73-3 à compter du 01-09-2025_0.pdf",
      "output_files": [
        "data/text/AGRI-TH-117.txt",
        "data/markdown/AGRI-TH-117.md",
        "data/json/AGRI-TH-117.json"
      ],
      "status": "extracted",
      "text_length": 8172,
      "warnings": [],
      "error": null
    },
    {
      "source_file": "Agriculture_AGRI/AGRI-TH-118 vA14-1 - Partie A.pdf",
      "output_files": [
        "data/text/AGRI-TH-118.txt",
        "data/markdown/AGRI-TH-118.md",
        "data/json/AGRI-TH-118.json"
      ],
      "status": "needs_review",
      "text_length": 1522,
      "warnings": [],
      "error": null
    },
    {
      "source_file": "Agriculture_AGRI/AGRI-TH-119 vA65-2 à compter du 01-04-2025_0.pdf",
      "output_files": [
        "data/text/AGRI-TH-119.txt",
        "data/markdown/AGRI-TH-119.md",
        "data/json/AGRI-TH-119.json"
      ],
      "status": "extracted",
      "text_length": 2183,
      "warnings": [],
      "error": null
    },
    {
      "source_file": "Agriculture_AGRI/AGRI-UT-101 vA24-2 après le 01-04-2017.pdf",
      "output_files": [
        "data/text/AGRI-UT-101.txt",
        "data/markdown/AGRI-UT-101.md",
        "data/json/AGRI-UT-101.json"
      ],
      "status": "extracted",
      "text_length": 2450,
      "warnings": [],
      "error": null
    },
    {
      "source_file": "Agriculture_AGRI/AGRI-UT-102 vA22-2.pdf",
      "output_files": [
        "data/text/AGRI-UT-102.txt",
        "data/markdown/AGRI-UT-102.md",
        "data/json/AGRI-UT-102.json"
      ],
      "status": "extracted",
      "text_length": 2160,
      "warnings": [],
      "error": null
    },
    {
      "source_file": "Agriculture_AGRI/AGRI-UT-103 vA19-1.pdf",
      "output_files": [
        "data/text/AGRI-UT-103.txt",
        "data/markdown/AGRI-UT-103.md",
        "data/json/AGRI-UT-103.json"
      ],
      "status": "extracted",
      "text_length": 1508,
      "warnings": [],
      "error": null
    },
    {
      "source_file": "Agriculture_AGRI/AGRI-UT-104 vA23-1.pdf",
      "output_files": [
        "data/text/AGRI-UT-104.txt",
        "data/markdown/AGRI-UT-104.md",
        "data/json/AGRI-UT-104.json"
      ],
      "status": "extracted",